node_url,url_alias,title,created,Notes
http://docs.apigee.com/node/37641,microgateway/v2.4.x/overview-edge-microgateway-v2.4.x,Overview of Edge Microgateway,2017-10-05 13:57:21,New version of Edge Microgateway
http://docs.apigee.com/node/37646,microgateway/v2.4.x/installing-edge-microgateway-v2.4.x,Installing Edge Microgateway,2017-10-05 14:55:21,New version of Edge Microgateway
http://docs.apigee.com/node/37651,microgateway/v2.4.x/setting-and-configuring-edge-microgateway-v2.4.x,Setting up and configuring Edge Microgateway,2017-10-05 14:56:40,New version of Edge Microgateway
http://docs.apigee.com/node/37656,microgateway/v2.4.x/operation-and-configuration-reference-edge-microgateway-v2.4.x,Operation and configuration reference for Edge Microgateway,2017-10-05 14:58:10,New version of Edge Microgateway
http://docs.apigee.com/node/37661,microgateway/v2.4.x/cli-reference-edge-microgateway-v2.4.x,CLI reference for Edge Microgateway,2017-10-05 14:59:38,New version of Edge Microgateway
http://docs.apigee.com/node/37666,microgateway/v2.4.x/using-plugins-v2.4.x,Using plugins,2017-10-05 15:19:53,New version of Edge Microgateway
http://docs.apigee.com/node/37671,microgateway/v2.4.x/developing-custom-plugins-v2.4.x,Developing custom plugins,2017-10-05 15:21:07,New version of Edge Microgateway
http://docs.apigee.com/node/37791,faq/performance-testing,Performance testing,2017-11-03 15:00:28,Edge network & security FAQ
http://docs.apigee.com/node/37796,faq/edge-network-design-firewalls,Edge network design and firewalls,2017-11-03 15:13:33,Edge network & security FAQ
http://docs.apigee.com/node/37801,faq/customer-security-testing-requests,Customer security testing requests,2017-11-03 15:50:39,Edge network & security FAQ
http://docs.apigee.com/node/37806,faq/reporting-vulnerabilities-edge,Reporting vulnerabilities in Edge,2017-11-03 15:56:38,Edge network & security FAQ
http://docs.apigee.com/node/37811,faq/business-continuity-planning-disaster-recovery,Business Continuity Planning and Disaster Recovery,2017-11-08 13:09:00,Edge network & security FAQ
http://docs.apigee.com/node/37816,faq/ddos-defense-edge,DDoS defense in Edge,2017-11-08 13:51:45,Edge network & security FAQ
http://docs.apigee.com/node/37821,faq/apigee-edge-backups,Apigee Edge backups,2017-11-08 14:00:54,Edge network & security FAQ
http://docs.apigee.com/node/37826,faq/anti-malware-apigee-edge-cloud,Anti-malware and Apigee Edge Cloud,2017-11-08 14:09:06,Edge network & security FAQ
http://docs.apigee.com/node/37831,faq/faq_home,Apigee Edge frequently asked questions,2017-11-08 15:09:55,Edge network & security FAQ
http://docs.apigee.com/node/37861,troubleshooting/content/insufficient-permissions-errors,Insufficient Permissions Errors,2017-11-15 11:30:04,New self-service troubleshooting topics
http://docs.apigee.com/node/37866,troubleshooting/content/what-include-if-you-contact-tech-support-or-community,What to include if you contact Tech Support or the Community,2017-11-15 11:35:52,New self-service troubleshooting topics
http://docs.apigee.com/node/37871,troubleshooting/content/forbidden-errors,Forbidden Errors,2017-11-15 11:46:43,New self-service troubleshooting topics
http://docs.apigee.com/node/37881,troubleshooting/content/call-timed-out-either-server-down-or-server-not-reachable,Call timed out; either server is down or server is not reachable,2017-11-16 16:43:45,New self-service troubleshooting topics
http://docs.apigee.com/node/37886,troubleshooting/content/unexpected-error-occurred-while-processing-updates,Unexpected error occurred while processing the updates,2017-11-17 10:16:07,New self-service troubleshooting topics
http://docs.apigee.com/node/37891,troubleshooting/content/error-while-fetching-children-path,Error while fetching children for path,2017-11-17 10:24:18,New self-service troubleshooting topics
http://docs.apigee.com/node/37896,troubleshooting/content/error-while-accessing-datastore,Error while accessing datastore,2017-11-17 10:29:29,New self-service troubleshooting topics
http://docs.apigee.com/node/37901,troubleshooting/content/error-creating-trace-session,Error creating trace session,2017-11-17 10:38:16,New self-service troubleshooting topics
